{
  "$schema": "https://json-schema.org/draft/2020-12/schema",
  "title": "WMP Test Vector",
  "description": "A single input/expected-output pair for WMP conformance testing.",
  "type": "object",
  "required": ["id", "description", "conformance_level", "input"],
  "properties": {
    "id": { "type": "string" },
    "description": { "type": "string" },
    "conformance_level": {
      "type": "string",
      "enum": ["basic", "secure", "flows", "agent", "registered", "wallet", "interop", "transport"]
    },
    "kind": { "type": "string", "enum": ["rpc", "interop", "transport-http"], "description": "How the vector is executed. Absent means the kind of the file it is in, as listed in manifest.json." },
    "setup": {
      "type": "object",
      "description": "Configuration of the responder under test. event_buffer and principals are for transport-http vectors (see README.md).",
      "properties": {
        "supported_versions": { "type": "array", "items": { "type": "string" }, "description": "Protocol versions the responder supports (version negotiation vectors)." },
        "event_buffer": { "type": "integer", "minimum": 1, "description": "Per-session event buffer size, in events." },
        "principals": { "type": "object", "additionalProperties": { "type": "string" }, "description": "Principal name to the Authorization header value that authenticates it." }
      }
    },
    "input": { "description": "The JSON-RPC message to send. For a transport-http vector: an array of steps (see README.md)." },
    "expected_response": { "description": "The expected JSON-RPC response (if request). Use null to assert no response is produced (e.g. notifications)." },
    "expected_error": { "$ref": "../schema/wmp-error.json", "description": "Expected error response." },
    "handler_action": {
      "type": "object",
      "description": "Instruction for the test harness handler. Used only in interop tests.",
      "required": ["method"],
      "properties": {
        "method": { "type": "string" },
        "return": { "description": "Value to return from the handler." },
        "error": { "description": "JSON-RPC error object to return from the handler." }
      }
    },
    "peer_options": {
      "type": "object",
      "description": "Peer-level configuration for the test harness. Used only in interop tests.",
      "properties": {
        "authorize": { "type": "boolean", "description": "If false, the authorizer hook rejects the request." },
        "validate": { "type": "boolean", "description": "If false, the validator hook rejects the params." }
      }
    },
    "expected_replay": { "description": "For a flow.complete vector: the retained copy a server yields when it replays the input (the live notification), per openid4x 3.1.4.2." },
    "must_refuse": { "type": "boolean", "description": "Negative vector: the input is a message a conforming receiver MUST refuse (a flow.complete a client rejects, a wmp.flow.action an orchestrator refuses, or a sign result the server fails the flow for). The harness asserts that its conformance check reports a violation; every vector without this member must pass the check." },
    "notes": { "type": "string" }
  }
}
